_id,interaction_id,user_id,session_id,interaction_type,messages,createdAt,updatedAt,__v
65fc10a1a7cb0f6660550c76,5fad7f2f-a41f-4c09-8d70-63e6ef70a876,d235cab9-2a67-4667-8857-a51566cffaf7,a734ed48-1506-4549-83ea-849d2f01630d,openai,"[[{'text': 'which food additives pose a risk to your physical health, and are likely to be listed on grocery store labels.', 'isBot': False}, {'text': 'Some common food additives that pose a risk to physical health include:\n1. Artificial sweeteners like aspartame, saccharin, and sucralose, which have been linked to negative health effects such as headaches, digestive issues, and possibly even cancer.\n2. Artificial colors like Red 40, Yellow 5, and Blue 1, which have been associated with behavioral issues in children, allergic reactions, and potentially carcinogenic effects.\n3. Preservatives like sodium nitrate/nitrite and BHA/BHT, which have been linked to an increased risk of cancer and other health issues.\n4. Hydrogenated oils/trans fats, which raise bad cholesterol levels and increase the risk of heart disease.\n5. Monosodium glutamate (MSG), a flavor enhancer that can cause allergic reactions, headaches, and other negative symptoms in some people.\n\nThese additives are likely to be listed on grocery store labels under their specific names or as E numbers (international codes for food additives). It is important to read ingredient labels carefully and be aware of the potential health risks associated with the additives in your food.', 'isBot': True}]]",2024-03-21 10:49:05.332,2024-03-21 10:49:05.332,0
65fc26cf7c343b1278a82a15,247d73a3-ad67-4a9c-8973-0c31848581fe,7c2b4159-df97-40a1-8376-23df2a4711ba,1d394a57-590c-4f35-9a37-34ec1b5688ac,openai,"[[{'text': 'Tell me species of small red ants that can bite people in the moutains in southern USA', 'isBot': False}, {'text': 'One species of small red ant that can bite people in the mountains in the southern USA is the Southern Fire Ant (Solenopsis xyloni). This species is commonly found in the southeastern United States, including mountainous regions, and their bites can cause pain, itching, and swelling. It is important to be cautious around ant mounds to avoid being bitten by these ants.', 'isBot': True}], [{'text': 'do you have their images', 'isBot': False}, {'text': 'No, I do not have the capability to display images. However, you can easily find images of celebrities or public figures by searching for them on the internet.', 'isBot': True}]]",2024-03-21 12:23:43.019,2024-03-21 12:23:43.019,0
65fc27f47c343b1278a82a25,add870d2-5189-4d43-a413-8d90ac8328d7,7c2b4159-df97-40a1-8376-23df2a4711ba,b49e33d6-2cb5-45f2-801b-cf791c567a93,openai,,2024-03-21 12:28:36.055,2024-03-21 12:28:36.055,0
65fc289e7c343b1278a82a31,1b1b60d8-ca1c-492d-b261-709044d3a609,7c2b4159-df97-40a1-8376-23df2a4711ba,32df3647-2a4a-4f87-af6c-4b3900047fec,openai,"[[{'text': 'list out causes of blood pressure', 'isBot': False}, {'text': '1. Genetics\n2. Aging\n3. Obesity\n4. High sodium intake\n5. Lack of physical activity\n6. Stress\n7. Smoking\n8. Excessive alcohol consumption\n9. Chronic kidney disease\n10. Thyroid disorders\n11. Sleep apnea\n12. Diabetes\n13. Certain medications, such as birth control pills, decongestants, and NSAIDs\n14. Adrenal gland disorders\n15. Family history of high blood pressure', 'isBot': True}]]",2024-03-21 12:31:26.255,2024-03-21 12:31:26.255,0
65fc2c7d7c343b1278a82a3d,9f2651f3-b60d-43ad-8e3f-ceb444db763e,7c2b4159-df97-40a1-8376-23df2a4711ba,06ed5ae9-c290-48f2-acb3-1004528c1c49,openai,"[[{'text': 'can solar energy panels for heating save more money than others?', 'isBot': False}, {'text': ""Solar energy panels for heating can save more money than other heating options in the long run, as they rely on the sun's free and abundant energy to generate heat. Once installed, solar panels require minimal maintenance and have no ongoing fuel costs, unlike traditional heating systems that rely on expensive fossil fuels or electricity. Additionally, many governments offer financial incentives and rebates for installing solar panels, making them a more cost-effective option in the long term. However, the upfront cost of purchasing and installing solar panels can be high, so it may take several years to recoup the initial investment through energy savings. Ultimately, the cost savings of solar panels for heating will depend on factors such as the local climate, energy consumption, and the cost of alternative heating sources in the area."", 'isBot': True}]]",2024-03-21 12:47:57.055,2024-03-21 12:47:57.055,0
65fc39ac9794d7470f140995,4a753fec-9661-4468-8759-672d11e43821,d80ef3e3-ebb7-40a5-9ce1-812e754809aa,5a577d2d-110b-4a4f-a6b7-2d4aeaa3cf5a,openai,"[[{'text': 'hi codex, i want to understand which food additives pose a risk to your physical health, and are likely to be listed on grocery store labels.', 'isBot': False}, {'text': ""Hi there! Food additives are substances added to food to preserve flavor or enhance its taste, appearance, or other qualities. While many additives are safe for consumption, some can have negative effects on your physical health. Here are some common food additives that may pose a risk and are likely to be listed on grocery store labels:\n\n1. Artificial sweeteners: Some artificial sweeteners like aspartame and sucralose have been linked to negative health effects such as headaches, digestive issues, and metabolic disorders.\n\n2. Artificial colors: Certain artificial colors like Red 40, Yellow 5, and Blue 1 have been associated with behavioral problems in children and allergic reactions in some individuals.\n\n3. Preservatives: Preservatives like sodium nitrate and sulfites are commonly used to extend the shelf life of processed foods, but they can be harmful to your health if consumed in large quantities. They have been linked to an increased risk of cancer and allergic reactions.\n\n4. Trans fats: These fats are commonly found in processed foods like baked goods, snacks, and fried foods. Consuming trans fats can increase your risk of heart disease, stroke, and other health issues.\n\n5. MSG (monosodium glutamate): MSG is a flavor enhancer commonly used in Asian cuisine and processed foods. Some people may experience symptoms like headaches, flushing, and chest pain after consuming foods containing MSG.\n\nIt's important to read food labels carefully and be aware of the ingredients in the products you are purchasing to avoid potential harmful additives. If you have concerns about specific additives, consult with a healthcare professional or nutritionist for personalized advice."", 'isBot': True}], [{'text': 'which food contain many harmful additives should be avoided?\n', 'isBot': False}, {'text': '1. Processed foods: Foods that are heavily processed and packaged often contain numerous harmful additives such as artificial colors, flavors, preservatives, and sweeteners.\n\n2. Sugary drinks: Sugary drinks like sodas and fruit juices often contain artificial sweeteners, high fructose corn syrup, and artificial colors that can have negative effects on health.\n\n3. Fast food: Fast food items like burgers, fries, and chicken nuggets are often loaded with preservatives, artificial additives, and unhealthy fats that can contribute to various health issues.\n\n4. Frozen meals: Frozen meals are convenient but often contain high levels of sodium, artificial flavors, and preservatives to extend their shelf life.\n\n5. Packaged snacks: Snack foods like chips, cookies, and crackers are typically filled with artificial flavors, colors, and preservatives to enhance their taste and appearance.\n\n6. Canned foods: Canned foods often contain artificial preservatives and additives to prevent spoilage and maintain their shelf life.\n\n7. Breakfast cereals: Many breakfast cereals are packed with artificial colors, flavors, preservatives, and added sugars that can be harmful to health if consumed in excess. \n\nOverall, it is best to focus on whole, unprocessed foods and limit consumption of foods with long lists of artificial additives and preservatives.', 'isBot': True}], [{'text': 'so what foods should I eat to avoid toxic additives?\n', 'isBot': False}, {'text': '- Fresh fruits and vegetables\n- Whole grains\n- Lean proteins like chicken, fish, and legumes\n- Dairy products like milk, yogurt, and cheese\n- Nuts and seeds\n- Herbs and spices for flavoring\n- Organic foods when possible\n- Foods labeled as ""all-natural"" or ""no additives""', 'isBot': True}]]",2024-03-21 13:44:12.304,2024-03-21 13:44:12.304,0
65fc3d0c9794d7470f14099d,cd2429c5-8ab6-41ff-aa5b-264e748cc908,d80ef3e3-ebb7-40a5-9ce1-812e754809aa,e75ae1f0-b058-4516-bc56-5f1094e05d1d,openai,"[[{'text': 'what is advantages and disadvantages of onventional methods of home heating (fossil energy sources) and solar panels.\n', 'isBot': False}, {'text': 'Advantages of Conventional Methods of Home Heating (Fossil Energy Sources):\n1. Reliability: Conventional methods of home heating, such as natural gas or oil furnaces, are proven and reliable sources of energy. They are widely available and can provide consistent heat to homes.\n2. Cost-Effective: Fossil energy sources tend to be less expensive upfront compared to alternative energy sources such as solar panels. This can make them a more affordable option for homeowners.\n3. Ease of Installation: Conventional heating systems are relatively easy to install and maintain, especially for homeowners who are already familiar with them.\n\nDisadvantages of Conventional Methods of Home Heating (Fossil Energy Sources):\n1. Environmental Impact: Burning fossil fuels releases greenhouse gases and contributes to air pollution, leading to negative effects on the environment and human health.\n2. Finite Resource: Fossil fuels are non-renewable resources, meaning they will eventually run out. This poses a long-term sustainability issue for relying on fossil energy sources for home heating.\n3. Fluctuating Prices: The cost of fossil fuels can be volatile and dependent on external factors such as global supply and demand, geopolitical events, and natural disasters.\n\nAdvantages of Solar Panels:\n1. Renewable Energy Source: Solar panels harness energy from the sun, which is a renewable resource that will never run out. This makes solar panels a sustainable option for home heating.\n2. Environmental Benefits: Solar panels produce clean energy and do not release greenhouse gases, making them an environmentally friendly alternative to fossil fuels.\n3. Long-Term Savings: While there is an upfront cost to installing solar panels, they can lead to long-term savings on energy bills as homeowners generate their own electricity.\n\nDisadvantages of Solar Panels:\n1. Initial Cost: Solar panels can be expensive to purchase and install, which can be a barrier for some homeowners considering transitioning to solar energy.\n2. Weather Dependent: Solar panels depend on sunlight to generate electricity, so they may not be as effective in areas with limited sunlight or during periods of cloudy weather.\n3. Space Requirements: Solar panels require a certain amount of space on a roof or property to be effective, which may not be feasible for all homeowners.', 'isBot': True}], [{'text': 'which is more expensive?', 'isBot': False}, {'text': 'It depends on the specific products or services being compared. Generally, luxury or high-end items tend to be more expensive than standard or budget options. However, some standard or budget items may also be more expensive depending on factors such as quality, brand, materials used, and other factors.', 'isBot': True}], [{'text': 'which is more expensive? conventional methods of home heating (fossil energy sources) and solar panels.', 'isBot': False}, {'text': 'Conventional methods of home heating using fossil energy sources are generally more expensive than using solar panels in the long run. While the initial cost of installing solar panels may be higher, the cost savings from using renewable energy sources like solar power can lead to significant savings on energy bills over time. Additionally, solar panels have a longer lifespan and require less maintenance compared to traditional heating systems, making them a cost-effective option in the long term.', 'isBot': True}]]",2024-03-21 13:58:36.469,2024-03-21 13:58:36.469,0
65fc3fde9794d7470f1409a9,5ce2ac99-7dd9-42f1-afcb-9b65a7b783da,d80ef3e3-ebb7-40a5-9ce1-812e754809aa,7a0af744-1f59-4331-9a53-376048678915,openai,"[[{'text': 'which species of small red ant can be seen on moutain when hiking?\n', 'isBot': False}, {'text': 'One species of small red ant that can be seen on mountains when hiking is the Western thatching ant (Formica obscuripes). These ants are commonly found in mountainous regions of North America and can often be seen foraging for food on hiking trails.', 'isBot': True}], [{'text': '\nwhich species of small red ant can be seen on moutain from southern USA  when hiking?', 'isBot': False}, {'text': ""One common species of small red ant that can be seen on mountains in the southern USA while hiking is the Southern Fire Ant (Solenopsis xyloni). These ants are known for their fiery sting and aggressive nature, so it's important to be cautious around them when out on the trails."", 'isBot': True}]]",2024-03-21 14:10:38.391,2024-03-21 14:10:38.391,0
65fc40d99794d7470f1409b1,2e4bc8cc-a802-4d4e-8fbf-fc0fd4fcb490,d80ef3e3-ebb7-40a5-9ce1-812e754809aa,b1cf5548-15d3-481d-9a57-0417f01c9a66,openai,"[[{'text': 'what causes high blood pressure? with symptom is headache accompanied by nausea', 'isBot': False}, {'text': 'High blood pressure, also known as hypertension, can be caused by various factors such as genetics, age, diet, lifestyle choices, and underlying health conditions. Some specific causes of high blood pressure include:\n\n- Excessive salt intake\n- Lack of physical activity\n- Obesity or being overweight\n- Smoking\n- Excessive alcohol consumption\n- Stress and anxiety\n- Family history of high blood pressure\n- Chronic kidney disease\n- Sleep apnea\n- Thyroid disorders\n\nHeadache accompanied by nausea can be a symptom of high blood pressure, particularly in cases of severe or sudden increases in blood pressure. However, it is important to note that these symptoms can also be caused by other conditions such as migraines, dehydration, or viral infections. If you are experiencing persistent headaches accompanied by nausea, it is important to consult a healthcare professional for proper evaluation and diagnosis.', 'isBot': True}]]",2024-03-21 14:14:49.511,2024-03-21 14:14:49.511,0
65fc5482e39a158fac2806a3,1f7de771-055f-4903-8e1e-bafa2120b756,c5902c7b-a503-4f84-9636-0676d4234518,38d7b272-f6b9-4459-86bc-d1accd5af63d,openai,"[[{'text': 'pro and cons of solar energy panels for home heating\n\n', 'isBot': False}, {'text': 'Pros:\n1. Environmentally friendly: Solar energy is a clean and renewable energy source, which reduces carbon emissions and helps combat climate change.\n2. Cost-effective: While the initial investment for installing solar panels can be high, they can save homeowners money in the long run by reducing electricity bills.\n3. Energy independence: Solar panels allow homeowners to generate their own electricity, reducing reliance on fossil fuels and the grid.\n4. Low maintenance: Solar panels require minimal maintenance and have a long lifespan, typically around 25 years.\n5. Government incentives: Many governments offer tax credits and rebates for installing solar panels, making them more affordable for homeowners.\n\nCons:\n1. Weather-dependent: Solar panels rely on sunlight to generate electricity, so they may not be as efficient during cloudy or rainy days.\n2. Initial cost: The upfront cost of purchasing and installing solar panels can be a barrier for some homeowners, although this cost is decreasing as technology improves.\n3. Space requirements: Solar panels require ample space and a suitable location for optimal sunlight exposure, which may not be possible for every home.\n4. Aesthetic impact: Some homeowners may find solar panels unattractive or disruptive to the appearance of their home.\n5. Energy storage: Solar panels only generate electricity when the sun is shining, so homeowners may need to invest in battery storage systems to store excess energy for use at night or on cloudy days.', 'isBot': True}], [{'text': 'issues that need to be considered in deciding between more conventional methods of home heating (fossil energy sources) and solar panels.\n', 'isBot': False}, {'text': ""1. Initial cost: Solar panels have a higher upfront cost compared to traditional heating methods, such as gas or oil heaters. It is important to consider your budget and financial resources before making a decision.\n\n2. Return on investment: While the initial cost of solar panels may be high, they can provide long-term savings on energy bills. It is important to calculate the potential savings over time to determine if investing in solar panels is a financially viable option.\n\n3. Energy efficiency: Solar panels are a renewable energy source and have lower environmental impacts compared to fossil fuel-based heating systems. Consider the environmental benefits of using solar panels for heating your home.\n\n4. Availability of sunlight: The effectiveness of solar panels depends on the availability of sunlight in your location. If you live in an area with limited sunlight or frequent cloud cover, solar panels may not be as efficient as other heating options.\n\n5. Maintenance and upkeep: Solar panels require regular maintenance to ensure optimal performance. Consider the time and effort required to maintain solar panels compared to traditional heating systems.\n\n6. Installation logistics: Installing solar panels may require modifications to your home's structure and electrical systems. Consider the logistical challenges and costs associated with installing solar panels before making a decision.\n\n7. Government incentives and rebates: Many government incentives and rebates are available for installing solar panels as a renewable energy source. Consider if you are eligible for any financial incentives that could offset the initial cost of installing solar panels.\n\n8. Energy independence: Solar panels can provide energy independence by generating your own electricity. Consider the benefits of having a self-sufficient energy source for heating your home.\n\n9. Resale value: Installing solar panels can increase the resale value of your home. Consider how solar panels may impact the value of your property if you plan to sell in the future."", 'isBot': True}]]",2024-03-21 15:38:42.304,2024-03-21 15:38:42.304,0
65fc555be39a158fac2806ad,28895e2d-e4b6-479f-9335-5d10062c0249,c5902c7b-a503-4f84-9636-0676d4234518,479c370f-48ba-4caf-9b80-318896576cb5,openai,,2024-03-21 15:42:19.844,2024-03-21 15:42:19.844,0
65fc55d8e39a158fac2806b5,a5b1c18d-0a5b-46cf-8190-05bab6f088a2,c5902c7b-a503-4f84-9636-0676d4234518,0debeafc-7787-47c5-a693-77234a77d33c,openai,"[[{'text': 'which food additives pose a risk to your physical health, and are likely to be listed on grocery store labels\n', 'isBot': False}, {'text': ""Some food additives that pose a risk to physical health and are commonly found on grocery store labels include:\n\n1. Artificial sweeteners such as aspartame, saccharin, and sucralose, which have been linked to various health concerns including headaches, digestive issues, and even potential links to cancer.\n\n2. Artificial colors like Red 40, Yellow 5, and Blue 1, which have been linked to hyperactivity in children and other behavioral issues.\n\n3. Preservatives like sodium nitrate/nitrite, BHA, and BHT, which have been linked to potential carcinogenic effects.\n\n4. MSG (monosodium glutamate), a flavor enhancer often used in processed foods, which has been linked to headaches, nausea, and other adverse reactions in some people.\n\n5. Trans fats, which are often found in hydrogenated oils and have been linked to an increased risk of heart disease and other health issues.\n\nIt's important to read food labels carefully and be aware of the potential risks associated with certain additives when making food choices."", 'isBot': True}]]",2024-03-21 15:44:24.150,2024-03-21 15:44:24.150,0
65fc5638e39a158fac2806bd,33892ff8-ab5e-4155-a333-7be9c69c14c8,c5902c7b-a503-4f84-9636-0676d4234518,efd22d80-5dd3-42ac-a165-05aca9bf0743,openai,"[[{'text': 'just stepped into an anthill of small red ants and has a large number of painful bites on her leg. what species of ants they are likely to be', 'isBot': False}, {'text': 'The small red ants that commonly bite humans are likely to be fire ants (solenopsis invicta). Fire ants are aggressive and their bites can cause painful, itchy welts on the skin. It is important to wash the affected area with soap and water and apply a cold compress to reduce swelling and discomfort. If you experience severe allergic reactions or symptoms, seek medical attention.', 'isBot': True}]]",2024-03-21 15:46:00.311,2024-03-21 15:46:00.311,0
65fd524b7d88869ed14fdc37,6bc4105e-efa6-4e77-89d0-1f1726f4b0f7,8331280f-4b3b-4285-8158-35a2fc40b5df,8b045794-a30d-46e7-84b4-1c63bd5ecaff,openai,"[[{'text': 'red ant bites symptoms\n', 'isBot': False}, {'text': 'Symptoms of red ant bites may include:\n- Pain and burning at the site of the bite\n- Itching and swelling\n- Redness and inflammation\n- Formation of a small blister or pustule\n- Allergic reactions may lead to more severe symptoms such as difficulty breathing, chest pain, and swelling of the face or throat.\n\nIf you experience severe symptoms or have a known allergy to red ant bites, seek immediate medical attention.', 'isBot': True}]]",2024-03-22 09:41:31.119,2024-03-22 09:41:31.119,0
65fd531e7d88869ed14fdc43,ac1c2af9-62a0-4b1a-807f-9936811800cb,8331280f-4b3b-4285-8158-35a2fc40b5df,f6ac68fe-13f6-458f-b4a6-077f1768ffac,openai,"[[{'text': 'which foods additive pose a riskto your health\n', 'isBot': False}, {'text': 'Some food additives that can pose a risk to your health include:\n\n1. Artificial sweeteners such as aspartame, saccharin, and sucralose, which have been linked to negative health effects including headaches, digestive issues, and potential long-term effects on metabolism.\n\n2. Sodium nitrite and nitrate, commonly found in processed meats like bacon and hot dogs, have been associated with an increased risk of cancer, particularly colon cancer.\n\n3. Monosodium glutamate (MSG), a flavor enhancer commonly used in Asian cuisine, has been linked to symptoms like headaches, nausea, and chest pain in some people.\n\n4. Trans fats, which are found in partially hydrogenated oils used in processed foods, have been linked to an increased risk of heart disease, stroke, and other health issues.\n\n5. Artificial food dyes, which are used to color processed foods, have been linked to hyperactivity in children, allergic reactions, and other negative effects on health.\n\nIt is important to read ingredient labels and be mindful of the types of additives and ingredients in the foods you consume to help minimize potential risks to your health.', 'isBot': True}]]",2024-03-22 09:45:02.410,2024-03-22 09:45:02.410,0
65fd53a37d88869ed14fdc47,8da0d628-c136-4ae4-abca-6edda23ca7ed,8331280f-4b3b-4285-8158-35a2fc40b5df,f6ac68fe-13f6-458f-b4a6-077f1768ffac,openai,"[[{'text': 'which food additives pose a risk to our physical health and are likely to be listed on grocery store labels\n', 'isBot': False}, {'text': 'Some food additives that pose a risk to physical health and are likely to be listed on grocery store labels include:\n\n1. Artificial sweeteners such as aspartame, saccharin, and sucralose, which have been linked to negative health effects such as headaches, digestive issues, and potential carcinogenicity.\n\n2. Sodium nitrate and nitrite, commonly used as preservatives in processed meats, have been associated with an increased risk of cancer and other health problems.\n\n3. Monosodium glutamate (MSG), a flavor enhancer commonly used in processed foods, has been linked to adverse reactions such as headaches, nausea, and muscle tightness.\n\n4. Artificial colors and dyes, such as Red 40 and Yellow 5, have been linked to hyperactivity in children, allergic reactions, and potential carcinogenicity.\n\n5. Trans fats, often found in processed foods as partially hydrogenated oils, have been linked to an increased risk of heart disease and other chronic health conditions.\n\n6. High fructose corn syrup, a sweetener commonly used in processed foods, has been linked to obesity, diabetes, and other health issues.\n\n7. Artificial preservatives such as BHA, BHT, and TBHQ have been associated with potential health risks including cancer and allergic reactions.', 'isBot': True}]]",2024-03-22 09:47:15.907,2024-03-22 09:47:15.907,0
