_id,interaction_id,user_id,session_id,interaction_type,messages,createdAt,updatedAt,__v
65fb3e71eddf897ea3091a8f,d457cb72-adee-4086-9e70-a4150a9c8bc4,4edf0ff5-b5aa-4957-9431-4fbf4cacaf6a,a27bf979-97ed-489d-8dcd-cd1dfb4fc0ab,openai,,2024-03-20 19:52:17.992,2024-03-20 19:52:17.992,0
65fb3f76eddf897ea3091a97,57de161e-217e-4ead-a4c9-0bae693c0024,4edf0ff5-b5aa-4957-9431-4fbf4cacaf6a,cc13e90f-8d51-4686-9580-8b18b56f7802,openai,"[[{'text': 'name one small red ant species in the southern usa', 'isBot': False}, {'text': 'Solenopsis invicta, also known as the red imported fire ant, is a small red ant species commonly found in the southern United States.', 'isBot': True}]]",2024-03-20 19:56:38.056,2024-03-20 19:56:38.056,0
65fb3ffaeddf897ea3091a9f,ef2a3095-4c24-467d-9a9d-2694ffd8ed81,4edf0ff5-b5aa-4957-9431-4fbf4cacaf6a,02e846b3-55dc-4713-a2d8-f144295d2657,openai,"[[{'text': 'what are issues that need to be considered in deciding between  conventional methods of home heating (fossil energy sources) and solar panels', 'isBot': False}, {'text': '1. Cost: Conventional methods of home heating using fossil energy sources may have lower upfront costs compared to installing solar panels. However, over time, solar panels can be more cost-effective due to lower or zero energy bills.\n\n2. Environmental impact: Fossil energy sources such as natural gas, oil, and coal emit greenhouse gases and contribute to climate change. In contrast, solar panels generate clean and renewable energy without producing harmful emissions.\n\n3. Energy efficiency: Solar panels are more energy-efficient compared to conventional heating systems as they directly convert sunlight into electricity. This can result in lower energy consumption and costs in the long run.\n\n4. Reliability: Conventional heating systems may be more reliable in certain regions with consistent access to fossil energy sources. Solar panels depend on sunlight, so their efficiency may vary depending on weather conditions and geographic location.\n\n5. Maintenance: Solar panels require minimal maintenance once installed, whereas conventional heating systems may require regular servicing and repairs.\n\n6. Government incentives: There may be government incentives, rebates, and tax credits available for installing solar panels that can help offset the initial cost and make them more financially attractive.\n\n7. Long-term considerations: Investing in solar panels can increase the value of a home and provide long-term savings on energy costs, while relying on fossil energy sources may become more expensive as resources deplete and demand increases.\n\n8. Resilience: Solar panels can provide energy independence and resilience during power outages or energy crises, while conventional heating systems may be vulnerable to supply chain disruptions or price fluctuations.', 'isBot': True}]]",2024-03-20 19:58:50.605,2024-03-20 19:58:50.605,0
65fb404aeddf897ea3091aa7,b790452e-0bd9-439c-81a0-d77ce1d24f3f,4edf0ff5-b5aa-4957-9431-4fbf4cacaf6a,f78d2301-5d15-4393-a778-d04276901baa,openai,"[[{'text': 'which food additives pose a risk to your physical health, and are likely to be listed on grocery store labels', 'isBot': False}, {'text': 'Some food additives that may pose a risk to physical health include:\n\n1. Artificial colors: Some artificial colors, such as Red 40 and Yellow 6, have been linked to behavioral issues and hyperactivity in children.\n\n2. Artificial sweeteners: Sweeteners like aspartame and saccharin have been associated with negative health effects, including headaches, digestive issues, and potential links to cancer.\n\n3. Preservatives: Preservatives like sodium nitrate and sulfites have been linked to allergies, asthma, and other adverse reactions in some individuals.\n\n4. Trans fats: Hydrogenated oils, which contain trans fats, have been linked to an increased risk of heart disease and other chronic health conditions.\n\n5. MSG (monosodium glutamate): This flavor enhancer has been linked to headaches, sweating, and other symptoms in some individuals.\n\nThese additives are likely to be listed on grocery store labels under their specific names or as part of a broader category (e.g. ""artificial colors"" or ""preservatives""). It\'s important to read ingredient labels carefully and consider potential risks before consuming processed foods with these additives.', 'isBot': True}]]",2024-03-20 20:00:10.876,2024-03-20 20:00:10.876,0
65fb541d72a34e612b78e6f5,7d4aed55-e61a-4f76-a5a9-0736903ce564,e0711a26-c616-463c-9b05-f0afaf871f31,26dcc03b-a604-4d6c-9c01-cc072cb18e31,openai,"[[{'text': 'name the small red ant spiecies that bite\n', 'isBot': False}, {'text': 'One such species is the red imported fire ant (Solenopsis invicta).', 'isBot': True}]]",2024-03-20 21:24:45.409,2024-03-20 21:24:45.409,0
65fb55c072a34e612b78e701,0d13390b-5945-4a86-bdec-b904f852ac68,e0711a26-c616-463c-9b05-f0afaf871f31,c028d42f-a486-4837-820b-09d11907e677,openai,"[[{'text': 'food additives pose a risk to your physical health\n', 'isBot': False}, {'text': 'Food additives are substances that are added to food to preserve flavor or enhance its appearance. While many food additives are generally recognized as safe by regulatory agencies such as the Food and Drug Administration (FDA), some additives have been linked to negative health effects.\n\nFor example, artificial colors and flavors, preservatives, and sweeteners have been associated with allergic reactions, digestive issues, and even more serious health concerns such as cancer and ADHD. Some additives may also contribute to chronic conditions such as obesity and diabetes.\n\nIt is important to be aware of the risks associated with food additives and to carefully read ingredient labels when purchasing packaged foods. Choosing minimally processed foods and organic products can help reduce your exposure to potentially harmful additives. Additionally, consulting with a healthcare professional or nutritionist can help you make informed choices about the foods you consume.', 'isBot': True}], [{'text': 'which food additives pose a risk to my physical health', 'isBot': False}, {'text': 'Some food additives that may pose a risk to physical health include:\n1. Artificial sweeteners like aspartame, saccharin, and sucralose, which have been linked to various health issues including headaches, digestive problems, and even cancer.\n2. Sodium nitrate and nitrite, commonly used as preservatives in processed meats, have been associated with an increased risk of cancer and other health problems.\n3. Monosodium glutamate (MSG), a flavor enhancer commonly found in Chinese food and processed foods, has been linked to headaches, sweating, and other adverse reactions in some individuals.\n4. Artificial food coloring, particularly those containing synthetic dyes like Red 40, Yellow 5, and Blue 1, have been linked to hyperactivity in children and other potential health risks.\n5. Trans fats, which are often found in processed foods and baked goods, have been linked to an increased risk of heart disease and other health problems.\nOverall, it is important to be aware of the potential risks associated with food additives and to limit consumption of processed foods that contain these additives.', 'isBot': True}]]",2024-03-20 21:31:44.317,2024-03-20 21:31:44.317,0
65fb587972a34e612b78e70d,020ecdb7-4fff-4227-b9fb-cb5913cecbb0,e0711a26-c616-463c-9b05-f0afaf871f31,70a21323-dfc8-4d81-ace2-c43dd72c6be9,openai,"[[{'text': 'my brother has constant headaches. Tonight his headache is accompanied by nausea, and his blood pressure is 120. What causes high blood pressure?', 'isBot': False}, {'text': ""There are many potential causes of high blood pressure, also known as hypertension, including:\n\n1. Genetics: Family history of hypertension can increase one's risk of developing high blood pressure.\n\n2. Lifestyle factors: Poor diet, lack of exercise, smoking, excessive alcohol consumption, and chronic stress can all contribute to high blood pressure.\n\n3. Age: As people get older, their risk of developing high blood pressure increases.\n\n4. Obesity: Being overweight or obese puts more strain on the heart and can lead to high blood pressure.\n\n5. Chronic conditions: Conditions such as diabetes, kidney disease, and sleep apnea can all contribute to high blood pressure.\n\n6. Medications: Some medications, including certain antidepressants and steroids, can cause an increase in blood pressure as a side effect.\n\nIt is important for your brother to see a doctor to determine the underlying cause of his high blood pressure and to develop a treatment plan to manage it effectively."", 'isBot': True}], [{'text': 'what about headaches with nausea and high blood pressure', 'isBot': False}, {'text': 'Headaches with nausea and high blood pressure can be a sign of a potentially serious condition such as a hypertensive crisis or preeclampsia. If you are experiencing these symptoms, it is important to seek medical attention as soon as possible. These symptoms could also be indicative of other conditions such as a migraine, tension headache, or sinus infection. It is best to consult a healthcare professional for a proper diagnosis and treatment plan.', 'isBot': True}]]",2024-03-20 21:43:21.939,2024-03-20 21:43:21.939,0
65fb5a8172a34e612b78e71d,60c46771-b146-43e4-9d62-40f5b46cf3c4,e0711a26-c616-463c-9b05-f0afaf871f31,ab2010e6-bfb6-40a5-86af-c0fdd74c5979,openai,"[[{'text': ' issues that need to be considered in deciding between more conventional methods of home heating (fossil energy sources) and solar panels.', 'isBot': False}, {'text': ""1. Cost: One of the primary factors to consider is the initial cost of installing solar panels compared to the cost of using fossil energy sources for heating. While solar panels can be expensive upfront, they can potentially provide long-term cost savings in the form of lower energy bills.\n\n2. Energy Efficiency: Solar panels are a renewable energy source and can be more energy-efficient than fossil energy sources. This can result in lower energy consumption and reduced environmental impact.\n\n3. Environmental Impact: Fossil energy sources, such as natural gas and oil, contribute to air pollution and greenhouse gas emissions. Solar panels provide a clean energy alternative that can help reduce carbon emissions and combat climate change.\n\n4. Reliability: Solar panels depend on sunlight to generate electricity, which means they may not be as reliable in areas with limited sunlight or during cloudy days. Fossil energy sources, on the other hand, provide a more consistent and reliable source of energy for heating.\n\n5. Maintenance and Longevity: Solar panels require regular maintenance to ensure optimal performance, while fossil energy sources may require less upkeep. Additionally, solar panels have a longer lifespan than traditional heating systems, which can result in long-term savings.\n\n6. Local Regulations and Incentives: Some regions offer incentives and rebates for installing solar panels, which can help offset the initial costs. It's important to research local regulations and incentives before deciding on a heating system.\n\n7. Energy Independence: Solar panels provide homeowners with energy independence and can reduce reliance on external energy sources. This can be a significant benefit for those looking to reduce their carbon footprint and increase self-sufficiency."", 'isBot': True}]]",2024-03-20 21:52:01.501,2024-03-20 21:52:01.501,0
65fbd58ebfa874c7f4238cd7,715391c7-db4f-4eb7-bca0-24373d1ab42a,15c09788-9078-4e28-9ec0-91d634c5b9ca,77b27376-0bc9-427f-97ac-a13a6974e6da,openai,"[[{'text': 'i found a list of healthy/unhealthy food for physical. Along familiar names, what are unexpectedly unhealthy food that most people dont know?\n', 'isBot': False}, {'text': 'Some unexpectedly unhealthy foods that people may not be aware of include:\n\n1. Granola bars: While they may seem like a healthy snack option, many store-bought granola bars are loaded with added sugars and unhealthy fats.\n\n2. Flavored yogurt: Flavored yogurt can be packed with added sugars and artificial ingredients, making it a not-so-healthy choice compared to plain Greek yogurt.\n\n3. Dried fruit: While dried fruit can be a convenient and tasty snack, it is often high in sugar and calories, making it easy to overeat.\n\n4. Protein bars: Many protein bars are heavily processed and contain added sugars, artificial sweeteners, and unhealthy fats, making them more like a candy bar than a nutritious snack.\n\n5. Smoothies: While homemade smoothies can be a nutritious option, many store-bought or restaurant smoothies are often packed with added sugars and syrups, making them more like a dessert than a healthy choice.', 'isBot': True}], [{'text': '2 food when eat separately are healthy, but when combined can be poisionous?\n', 'isBot': False}, {'text': 'Two foods that are healthy when eaten separately but can be toxic when combined are tomatoes and dairy products. Tomatoes contain high levels of acidity, which can curdle dairy products when they are combined. This can lead to digestive issues and discomfort for some individuals. It is recommended to consume these foods separately to avoid any potential negative effects.', 'isBot': True}]]",2024-03-21 06:37:02.168,2024-03-21 06:37:02.168,0
65fbd85cbfa874c7f4238ce5,ec061f1c-449e-4db4-80f4-9bf10baea658,15c09788-9078-4e28-9ec0-91d634c5b9ca,c9c2a626-e7e3-4ac8-bfb9-33eef5cec0cd,openai,"[[{'text': 'what are best option for nowsaday home heating\n', 'isBot': False}, {'text': ""There are several options for home heating available today, each with its own benefits and drawbacks. Some popular options include:\n\n1. Gas furnaces: Gas furnaces are a cost-effective and efficient option for heating your home. They provide quick and reliable heat, and are typically less expensive to operate than electric heating systems.\n\n2. Electric heat pumps: Heat pumps are an energy-efficient option for heating your home. They work by transferring heat from the air or ground into your home, rather than generating heat from fuel. While they may have a higher upfront cost, they can save you money on your energy bills in the long run.\n\n3. Radiant floor heating: Radiant floor heating is a luxurious option that provides consistent, comfortable warmth throughout your home. This system can be installed under various types of flooring, such as tile, hardwood, or carpet, and is energy-efficient.\n\n4. Biomass boilers: Biomass boilers burn organic materials, such as wood pellets or logs, to heat your home. They are a renewable heating option and can help reduce your carbon footprint.\n\n5. Ductless mini-split systems: Ductless mini-split systems are a flexible option for heating and cooling individual rooms in your home. They are easy to install and highly energy-efficient.\n\nUltimately, the best option for your home will depend on factors such as your budget, the size of your home, and your heating needs. It's best to consult with a professional HVAC contractor to determine the most suitable heating system for your specific situation."", 'isBot': True}], [{'text': 'i have a house in tropical region, but it still has winter. The winter temp hovering around 9~20 degree celcious. What is the best option of home heating for this house\n', 'isBot': False}, {'text': 'For a tropical region with mild winter temperatures, a good option for home heating would be a heat pump system. Heat pumps are energy-efficient, cost-effective, and can provide both heating and cooling functions. They work by transferring heat from the outside air into your home during the winter months and vice versa during the summer. This makes them a versatile and practical choice for regions with mild winters. Additionally, heat pumps are environmentally friendly and can help reduce your carbon footprint.', 'isBot': True}], [{'text': 'are heat pumps safe for kids?\n', 'isBot': False}, {'text': ""Generally speaking, heat pumps are safe for kids as long as they are properly installed and maintained. However, as with any heating or cooling system, it's important to take precautions to ensure the safety of children, such as keeping the unit out of reach and making sure that any potential hazards are properly secured. It's always a good idea to consult with a professional HVAC technician to ensure that your heat pump is operating safely."", 'isBot': True}], [{'text': 'in compare with solar panels, which one better?\n', 'isBot': False}, {'text': ""It ultimately depends on the specific needs and circumstances of the individual or organization in question. \n\nSolar panels are a renewable energy source that convert sunlight into electricity, making them an environmentally friendly option. They can be used to power homes, businesses, and even entire communities. However, solar panels are often expensive to install and may not be feasible for all locations due to factors such as shading or limited sunlight exposure.\n\nOn the other hand, other energy sources such as wind power or hydroelectricity may be more cost-effective or practical in certain situations. Wind turbines can generate electricity when there is sufficient wind, while hydroelectric power harnesses the energy of flowing water to produce electricity.\n\nIn general, solar panels are a popular and environmentally friendly option for renewable energy, but it's important to carefully consider all the options and factors involved before making a decision."", 'isBot': True}], [{'text': 'solar panels and heat-pump, which one better for my house ', 'isBot': False}, {'text': ""It depends on a few factors such as your location, energy usage, and budget. Solar panels are a great option for generating clean energy and reducing your electricity bills. However, they can be expensive to install upfront.\n\nOn the other hand, a heat pump is a more efficient way to heat and cool your home compared to traditional HVAC systems. Heat pumps can also help reduce your energy costs and are more environmentally friendly.\n\nIf you have the budget for both, it may be worth considering a combination of solar panels and a heat pump to maximize your energy savings and reduce your carbon footprint. Ultimately, it's best to consult with a professional to determine the best option for your specific needs and circumstances."", 'isBot': True}]]",2024-03-21 06:49:00.929,2024-03-21 06:49:00.929,0
65fbd9fbbfa874c7f4238cf1,ca748e20-4558-40df-841d-c7dfa259c1c1,15c09788-9078-4e28-9ec0-91d634c5b9ca,baf15b6d-a11d-4f5e-9f20-a9172965568a,openai,"[[{'text': 'type of red ants you can meet in sourthern mountain USA', 'isBot': False}, {'text': '1. Red imported fire ants (Solenopsis invicta)\n2. Southern fire ants (Solenopsis xyloni)\n3. Texas leafcutting ants (Atta texana)\n4. Eastern velvet ants (Dasymutilla occidentalis)\n5. Western thatching ants (Formica obscuripes)', 'isBot': True}], [{'text': 'which one of those can be met during hiking?\n', 'isBot': False}, {'text': 'Encountering wildlife, taking in beautiful scenic views, and getting exercise can all be met during hiking.', 'isBot': True}]]",2024-03-21 06:55:55.198,2024-03-21 06:55:55.198,0
65fbda86bfa874c7f4238cfd,0de2692b-707f-4cb7-9d71-b0a4b3699c45,15c09788-9078-4e28-9ec0-91d634c5b9ca,249c1d74-8bec-4e93-8eb5-1e54dd463aed,openai,"[[{'text': 'what are usual causes of high blood pressure at young people\n', 'isBot': False}, {'text': ""Some common causes of high blood pressure in young people include:\n\n1. Obesity: Being overweight or obese can put strain on the heart and blood vessels, leading to high blood pressure.\n\n2. Unhealthy diet: Consuming too much salt, saturated fats, and processed foods can contribute to high blood pressure.\n\n3. Lack of physical activity: Not getting enough exercise can make it harder for the heart to pump blood effectively, leading to high blood pressure.\n\n4. Smoking: Smoking tobacco can constrict blood vessels and raise blood pressure.\n\n5. Excessive alcohol consumption: Drinking too much alcohol can raise blood pressure and also contribute to weight gain.\n\n6. Stress: Chronic stress can increase blood pressure by triggering the release of stress hormones.\n\n7. Genetics: Family history of high blood pressure can increase the risk of developing the condition at a young age.\n\nIt's important for young people to have regular check-ups with a healthcare provider to monitor their blood pressure and address any potential risk factors. Lifestyle changes such as maintaining a healthy weight, eating a balanced diet, exercising regularly, reducing stress, and avoiding smoking and excessive alcohol consumption can help prevent or manage high blood pressure."", 'isBot': True}]]",2024-03-21 06:58:14.010,2024-03-21 06:58:14.010,0
65fbe425b5085a8eea447503,8adf40bc-10b1-4530-8aa2-21f2d5e4775e,34f7c191-ff70-407c-b818-49e35cbb068f,e3e1c5d4-40d5-4e64-8bba-c9cda4923738,openai,"[[{'text': 'What are the benefits of solar energy panels for heating when building a new house?', 'isBot': False}, {'text': ""1. Reduced energy bills: Installing solar panels for heating in a new house can significantly reduce energy bills, as the panels use the sun's energy to heat water and provide heating for the home.\n\n2. Environmental benefits: Solar energy is a clean, renewable source of energy that can help reduce carbon emissions and lessen the impact on the environment.\n\n3. Increase property value: Homes with solar panels are often seen as more desirable and energy-efficient, which can increase the resale value of the property.\n\n4. Energy independence: By generating your own energy through solar panels, you can become more self-sufficient and less reliant on external sources of energy.\n\n5. Long-term savings: While the initial cost of installing solar panels may be high, they can provide long-term savings on energy bills over the lifespan of the panels.\n\n6. Rebates and incentives: Many governments and energy companies offer rebates and incentives for installing solar panels, making them a more affordable option for homeowners.\n\n7. Reliability: Solar energy is a reliable source of energy that is not susceptible to fluctuations in energy prices or supply, ensuring a consistent source of heating for your home."", 'isBot': True}], [{'text': 'how much money do you save with them?', 'isBot': False}, {'text': ""It depends on the individual's spending habits and the specific ways in which they are able to save with the company. Some people may save a significant amount of money by taking advantage of discounts, deals, and rewards offered by the company, while others may not save as much. It is recommended to track your savings and compare them to your previous spending habits to determine the exact amount saved."", 'isBot': True}]]",2024-03-21 07:39:17.532,2024-03-21 07:39:17.532,0
65fbe4c5b5085a8eea44750d,8ad9ae0e-107e-4351-8f41-597eeee674cf,34f7c191-ff70-407c-b818-49e35cbb068f,0e4dc1a8-d695-4dc2-aa12-0e384fdfb65d,openai,"[[{'text': 'what causes high blood pressure?', 'isBot': False}, {'text': 'There are several factors that can contribute to high blood pressure, including:\n\n1. Genetics: High blood pressure can run in families, suggesting a genetic predisposition to the condition.\n\n2. Lifestyle factors: Unhealthy habits such as a diet high in salt, alcohol consumption, smoking, lack of physical activity, and being overweight can all contribute to high blood pressure.\n\n3. Age: Blood pressure tends to increase with age as the arteries become less flexible.\n\n4. Chronic conditions: Conditions like kidney disease, diabetes, and sleep apnea can increase the risk of high blood pressure.\n\n5. Stress: Chronic stress can also contribute to high blood pressure.\n\n6. Medications: Certain medications, such as decongestants, some antidepressants, and hormonal contraceptives, can lead to high blood pressure as a side effect.\n\nIt is important to monitor blood pressure regularly and make lifestyle changes to help manage and prevent high blood pressure.', 'isBot': True}]]",2024-03-21 07:41:57.345,2024-03-21 07:41:57.345,0
65fbe5b5b5085a8eea44751b,d839c41a-3e7b-4aae-bb82-24efa02dd5cc,34f7c191-ff70-407c-b818-49e35cbb068f,bc9fc17b-7719-4ddd-8f62-b119e178f1fa,openai,"[[{'text': 'which food bad for physical health\n', 'isBot': False}, {'text': 'Some foods that are generally considered bad for physical health include:\n\n- Fast food: Often high in fat, calories, and sodium, leading to weight gain and various health issues like heart disease and diabetes.\n- Processed foods: Packed with unhealthy additives, preservatives, and artificial ingredients that can contribute to chronic diseases.\n- Sugary foods and drinks: Can cause weight gain, tooth decay, and increase the risk of developing type 2 diabetes and heart disease.\n- Fried foods: High in unhealthy trans fats and calories, leading to weight gain and increased risk of heart disease.\n- Excess alcohol: Can lead to liver damage, weight gain, and increase the risk of various health issues like heart disease and certain types of cancer.', 'isBot': True}]]",2024-03-21 07:45:57.927,2024-03-21 07:45:57.927,0
65fbe68ab5085a8eea447523,c96c34c5-1d1a-49ca-9dcb-4a2e018bbc57,34f7c191-ff70-407c-b818-49e35cbb068f,e46ed73b-23a6-4185-84ce-9e0a5f82c2e6,openai,"[[{'text': 'USA red small ants\n', 'isBot': False}, {'text': 'There are several species of red small ants found in the USA, including the red imported fire ant (Solenopsis invicta), the red harvester ant (Pogonomyrmex barbatus), and the red pavement ant (Tetramorium caespitum). These ants are known for their aggressive behavior and painful stings. It is important to be cautious around these ants and avoid disturbing their nests.', 'isBot': True}]]",2024-03-21 07:49:30.557,2024-03-21 07:49:30.557,0
