_id,interaction_id,user_id,session_id,interaction_type,messages,createdAt,updatedAt,__v
65fbecc155a41b477058a74d,c67f0ff8-b736-42e2-9be8-ff52a46c450f,2fbf76df-1101-4ac6-b75b-f49df2266232,d74dd6cf-dfff-4ab3-a496-7def3c44ae98,openai,"[[{'text': 'what causes high blood pressure\n\n', 'isBot': False}, {'text': 'There are several factors that can contribute to high blood pressure, including:\n\n1. Genetics: Family history of high blood pressure can increase your risk of developing it yourself.\n\n2. Age: Blood pressure tends to increase with age, as blood vessels become stiffer and narrower.\n\n3. Lifestyle factors: Unhealthy habits such as poor diet, lack of physical activity, smoking, and excessive alcohol consumption can all contribute to high blood pressure.\n\n4. Stress: Chronic stress can cause your body to release hormones that constrict blood vessels and increase blood pressure.\n\n5. Chronic conditions: Conditions such as obesity, diabetes, and kidney disease can also increase your risk of developing high blood pressure.\n\n6. Medications: Certain medications, such as oral contraceptives, decongestants, and some anti-inflammatory drugs, can raise blood pressure as a side effect.\n\n7. Sleep apnea: This condition, characterized by pauses in breathing during sleep, has been linked to high blood pressure.\n\nIt is important to consult with a healthcare provider to determine the specific cause of high blood pressure and develop a treatment plan.', 'isBot': True}]]",2024-03-21 08:16:01.406,2024-03-21 08:16:01.406,0
65fbee6255a41b477058a757,addbbd45-a30e-4bf9-a301-1d6963044c1e,2fbf76df-1101-4ac6-b75b-f49df2266232,f5792c62-e6b5-47d8-8777-3eabe57aac11,openai,"[[{'text': 'What species of small red ants causes painful bites ', 'isBot': False}, {'text': 'Fire ants, also known as red imported fire ants, are a species of small red ants that cause painful bites. Their bites can result in intense burning sensations, redness, swelling, and even the formation of pustules. These ants are aggressive and will swarm and sting in response to any perceived threat, making them a nuisance and danger to humans and animals alike.', 'isBot': True}]]",2024-03-21 08:22:58.064,2024-03-21 08:22:58.064,0
65fbefd655a41b477058a766,1450a398-194b-4004-b64a-2610c42ef7a4,2fbf76df-1101-4ac6-b75b-f49df2266232,2bcb89d9-78fb-4a54-b6a7-6f19cb7dc791,openai,"[[{'text': 'what issues should I consider in dexiding between conventional methods of home heating (fossil energy sources) and solar panels\n', 'isBot': False}, {'text': ""When deciding between conventional methods of home heating (fossil energy sources) and solar panels, there are a few key issues to consider:\n\n1. Cost: While installing solar panels typically requires a significant upfront investment, they can ultimately help to lower your long-term energy costs as they rely on the sun's renewable energy source. In contrast, conventional methods of home heating can be cheaper to install initially but may result in higher energy bills in the long run.\n\n2. Environmental impact: Conventional methods of home heating, such as oil or gas furnaces, contribute to air pollution and greenhouse gas emissions. On the other hand, solar panels produce clean energy and help reduce your carbon footprint.\n\n3. Reliability and availability: Fossil energy sources can be reliant on fluctuating fuel prices and availability, as well as geopolitical factors. Solar panels, once installed, rely on the sun's energy which is abundant and consistent in most regions.\n\n4. Maintenance and durability: Conventional heating systems may require regular maintenance and repairs, whereas solar panels typically have a longer lifespan and require minimal maintenance.\n\n5. Energy independence: Solar panels can provide you with energy independence and reduce your reliance on the grid, potentially saving you money and increasing your energy security.\n\n6. Incentives and rebates: There may be government incentives and rebates available for installing solar panels, making them a more cost-effective option in the long run.\n\n7. Resale value: Solar panels can increase the resale value of your home, as they are considered a desirable feature for environmentally conscious buyers.\n\nUltimately, the decision between conventional methods of home heating and solar panels will depend on your individual circumstances, budget, and priorities. It may be helpful to consult with a professional to assess your specific needs and determine the best option for your home."", 'isBot': True}]]",2024-03-21 08:29:10.589,2024-03-21 08:29:10.589,0
65fbf01755a41b477058a76a,cf53e726-ccf1-47d9-bedd-4234770b0b1e,fe53df51-c33e-4114-986c-c9efcca99259,f67f8cba-3650-4552-bf99-6384412581a1,openai,"[[{'text': 'Hey, please act like an expert in zoology specialitzed on ants in the south of USA. What species of small red ants will cause numerous painful bites? ', 'isBot': False}, {'text': 'One species of small red ants that are known to cause numerous painful bites in the southern United States is the fire ant (Solenopsis invicta). Fire ants are aggressive and will swarm and sting in defense of their nest, delivering painful stings that often result in red, itchy welts. It is important to be cautious around fire ant nests as their stings can be quite painful and potentially dangerous, especially to individuals who are allergic to insect venom.', 'isBot': True}], [{'text': 'are there any other species that fit my description? ', 'isBot': False}, {'text': 'It is unclear what specific description you are referring to. Could you provide more details so I can provide a more accurate answer? Thank you.', 'isBot': True}]]",2024-03-21 08:30:15.561,2024-03-21 08:30:15.561,0
65fbf23155a41b477058a776,300eb413-19e9-47e9-aaa7-760fe755fea3,fe53df51-c33e-4114-986c-c9efcca99259,6bba4de7-877c-434b-b6a6-def508442b25,openai,"[[{'text': 'Hi, please behave like a nutrition scientist. Tell me a sufficient list of food additives, that pose a risk to my physical health, at least 20 additives. For each additive on the list, tell me how i can identify it on a frocery store label. ', 'isBot': False}, {'text': '1. High fructose corn syrup - Look for ""high fructose corn syrup"" or ""HFCS"" on the ingredient list.\n2. Artificial sweeteners (aspartame, saccharin, sucralose) - Look for ""aspartame,"" ""saccharin,"" or ""sucralose"" on the ingredient list.\n3. Trans fats - Look for ""partially hydrogenated oil"" or ""trans fat"" on the ingredient list.\n4. Artificial colors (red 40, yellow 5, blue 1) - Look for the specific color followed by a number (e.g. ""Red 40"") on the ingredient list.\n5. Artificial flavors - Look for ""artificial flavors"" on the ingredient list.\n6. MSG (monosodium glutamate) - Look for ""monosodium glutamate"" or ""MSG"" on the ingredient list.\n7. Sodium nitrate/nitrite - Look for ""sodium nitrate"" or ""sodium nitrite"" on the ingredient list.\n8. BHA (butylated hydroxyanisole) - Look for ""BHA"" on the ingredient list.\n9. BHT (butylated hydroxytoluene) - Look for ""BHT"" on the ingredient list.\n10. Carrageenan - Look for ""carrageenan"" on the ingredient list.\n11. Potassium bromate - Look for ""potassium bromate"" on the ingredient list.\n12. Potassium benzoate - Look for ""potassium benzoate"" on the ingredient list.\n13. Propyl gallate - Look for ""propyl gallate"" on the ingredient list.\n14. Sulfites - Look for ""sulfites"" or ""sulfur dioxide"" on the ingredient list.\n15. Sodium benzoate - Look for ""sodium benzoate"" on the ingredient list.\n16. Parabens - Look for ""parabens"" on the ingredient list.\n17. Butylated hydroxyanisole - Look for ""butylated hydroxyanisole"" on the ingredient list.\n18. Polysorbate 80 - Look for ""polysorbate 80"" on the ingredient list.\n19. Titanium dioxide - Look for ""titanium dioxide"" on the ingredient list.\n20. Artificial preservatives (sodium benzoate, potassium sorbate) - Look for these specific preservatives on the ingredient list.\n\nIt is important to read ingredient labels carefully and avoid products with these additives if you are concerned about their potential risks to your health.', 'isBot': True}], [{'text': 'please rank the from most harmful too least harmful. ', 'isBot': False}, {'text': ""It appears that you are asking to rank a set of items by their level of harm, but you didn't provide the actual list of items to be ranked. Please provide more specific information so that I can assist you with ranking the items from most harmful to least harmful."", 'isBot': True}]]",2024-03-21 08:39:13.792,2024-03-21 08:39:13.792,0
65fbf32b55a41b477058a78c,809828c1-8f34-4056-9061-704b380651d0,2fbf76df-1101-4ac6-b75b-f49df2266232,a5cd2ab1-a390-4f15-b130-dc96e1f88186,openai,"[[{'text': 'Which food additives pose a risk to my physical health and are likely to be listed on grocery store labels\n', 'isBot': False}, {'text': ""There are several food additives that can pose a risk to physical health and are commonly listed on grocery store labels. Some examples include:\n\n1. Artificial sweeteners like aspartame, sucralose, and saccharin, which have been linked to negative health effects including headaches, digestive issues, and potential carcinogenicity.\n\n2. Artificial colors like Red 40, Yellow 5, and Blue 1, which have been associated with behavioral issues in children and may have adverse effects on health.\n\n3. Sodium nitrite and sodium nitrate, which are used as preservatives in processed meats and have been linked to an increased risk of certain types of cancer.\n\n4. Trans fats, which are often found in partially hydrogenated oils and can raise cholesterol levels and increase the risk of heart disease.\n\n5. MSG (monosodium glutamate), a flavor enhancer that has been linked to headaches, nausea, and other allergic reactions in some individuals.\n\nIt's important to read food labels carefully and be aware of these potentially harmful additives when making food choices. Opting for whole, unprocessed foods whenever possible can help minimize exposure to these additives."", 'isBot': True}]]",2024-03-21 08:43:23.209,2024-03-21 08:43:23.209,0
65fbf46f55a41b477058a796,cfdba430-caf5-4fa0-a388-e2069b4cbdd2,fe53df51-c33e-4114-986c-c9efcca99259,46344b5b-4d61-4c2d-b681-4b61c7698dbb,openai,"[[{'text': 'Please behave like a doctor specified on chronic headache. My brother has chronic headaches. One night his headache was accompanied by nausea, and his blood pressure was 120. What causes high blood pressure in this case?', 'isBot': False}, {'text': ""Hello, I'm sorry to hear about your brother's chronic headaches and the recent episode of nausea accompanied by high blood pressure. Chronic headaches can be caused by a variety of factors such as tension, stress, dehydration, poor posture, or even certain medical conditions. In some cases, chronic headaches can also be a symptom of high blood pressure.\n\nHigh blood pressure (hypertension) can be a potential cause for chronic headaches, especially if it is accompanied by other symptoms such as nausea. When blood pressure is consistently high, it can put strain on the blood vessels in the brain, leading to headaches. Additionally, high blood pressure can also cause changes in the blood vessels that supply the brain, leading to reduced blood flow and oxygen delivery, which can trigger headaches.\n\nIt is important to monitor your brother's blood pressure regularly and consult with a healthcare provider to determine the underlying cause of his chronic headaches and high blood pressure. Treatment options may include lifestyle changes, medication, and other interventions to help manage his symptoms and improve his overall health. I recommend seeking medical advice for further evaluation and management of his condition.\n\nI hope this information helps, and I wish your brother a speedy recovery."", 'isBot': True}], [{'text': 'Please behave like a doctor specified on chronic headache. My brother has chronic headaches. One night his headache was accompanied by nausea, and his blood pressure was 120. Do you think the headache is caused by the high blood preassure or do you think the blood preassure rose due to the headache or the cases of the headache. Please explain how these symptoms can be interconnected? \n', 'isBot': False}, {'text': ""As a doctor specializing in chronic headaches, it is important to consider all possible causes of your brother's symptoms. In the case of chronic headaches accompanied by nausea and a slightly elevated blood pressure reading of 120, it is possible that the headache could be causing the increase in blood pressure. Headaches can trigger a stress response in the body, leading to elevated blood pressure.\n\nOn the other hand, high blood pressure can also be a contributing factor to chronic headaches. Hypertension can lead to changes in blood flow to the brain, potentially causing headaches. It is also possible that both conditions are independently contributing to each other, creating a cycle of symptoms.\n\nIt is important to monitor your brother's blood pressure regularly and consult with a healthcare provider to determine the underlying cause of his symptoms. Depending on the specific circumstances, treatment options may include lifestyle changes, medication management, and stress management techniques.\n\nOverall, the interconnectedness of chronic headaches and high blood pressure underscores the importance of addressing both conditions simultaneously for optimal management and symptom relief. It is essential for your brother to work closely with his healthcare provider to develop a personalized treatment plan tailored to his specific needs."", 'isBot': True}]]",2024-03-21 08:48:47.491,2024-03-21 08:48:47.491,0
65fbf71155a41b477058a79e,dd8e5c1e-d256-4768-afca-10e522401c7b,fe53df51-c33e-4114-986c-c9efcca99259,6fa6d496-756a-4721-9b64-45b8c99de03f,openai,"[[{'text': 'Behave like a expert in home construction and energy systems for homes. For both options below, tell me the five most crucial benefits and disadvantages when considering to install them in your house: \n1. heating the house based on solar energy panels \n2. heating the house with convential methods like with fossil energy sources\n\nAfterward listing the benefits and disadvantages compare both options and highlight issues that need to be considered for deciding between the two methods. ', 'isBot': False}, {'text': 'Heating the house based on solar energy panels:\n\nBenefits:\n1. Environmentally friendly: Solar energy is a renewable and clean source of energy, reducing carbon footprint.\n2. Cost-effective in the long run: Once the initial investment in solar panels is made, heating the house becomes virtually free.\n3. Energy independence: Solar panels generate electricity on-site, reducing dependency on external sources.\n4. Low maintenance: Solar panels require minimal maintenance and have a long lifespan.\n5. Government incentives: There are often tax incentives and rebates available for installing solar panels.\n\nDisadvantages:\n1. High upfront cost: The initial installation cost of solar panels can be expensive.\n2. Dependency on weather: Solar energy may not be reliable in cloudy or rainy days.\n3. Space requirements: Solar panels require a significant amount of roof space or land for installation.\n4. Storage limitations: Energy storage systems may be needed for consistent heating during non-sunlight hours.\n5. Technology limitations: Solar panels may not be suitable for all locations or building structures.\n\nHeating the house with conventional methods like with fossil energy sources:\n\nBenefits:\n1. Immediate availability: Fossil energy sources are readily available for heating the house.\n2. Consistent heating: Fossil fuel-based heating systems can provide consistent heating irrespective of external conditions.\n3. Technological advancement: Conventional heating systems are well-established and widely used.\n4. Lower upfront cost: The initial cost of installing a conventional heating system is usually lower than solar panels.\n5. Easy to maintain: Conventional heating systems require less maintenance compared to solar panels.\n\nDisadvantages:\n1. Environmental impact: Fossil fuel-based heating contributes to air pollution and greenhouse gas emissions.\n2. Rising costs: Fossil fuel prices are volatile and may increase over time.\n3. Energy dependency: Relying on fossil fuels makes households vulnerable to price fluctuations and shortages.\n4. Limited lifespan: Conventional heating systems have a shorter lifespan compared to solar panels.\n5. Government regulations: There are increasing regulations on emissions and waste disposal associated with fossil fuel-based heating.\n\nWhen comparing the two options, it is crucial to consider factors such as cost, environmental impact, reliability, maintenance, and long-term sustainability. While solar energy offers benefits in terms of environmental friendliness and cost-effectiveness in the long run, conventional methods provide immediate availability and consistent heating. Ultimately, the decision to install solar panels or rely on fossil fuel-based heating systems will depend on individual preferences, budget, location, and energy efficiency goals.', 'isBot': True}]]",2024-03-21 09:00:01.329,2024-03-21 09:00:01.329,0
65fc01fc0b43e64c1851bdcf,330a7382-954a-48cd-94b5-8e958bb82bf4,525d6692-2c89-4871-b945-28f5d35a789b,15b8d2d6-3232-43d6-adcb-eef42ae7f8eb,openai,,2024-03-21 09:46:36.184,2024-03-21 09:46:36.184,0
65fc02650b43e64c1851bdd7,783cebe7-d705-401d-97f9-64bbc481ad84,525d6692-2c89-4871-b945-28f5d35a789b,79585f74-1396-4770-908a-52cfc15eb79c,openai,"[[{'text': 'what causes high blood pressure', 'isBot': False}, {'text': ""There are several factors that can contribute to high blood pressure, also known as hypertension. These include:\n\n1. Family history: Genetics can play a role in determining a person's risk of developing high blood pressure. If a close family member has hypertension, you may be more likely to develop it as well.\n\n2. Age: Blood pressure tends to increase with age as blood vessels become less flexible and more narrow.\n\n3. Lifestyle factors: Unhealthy habits such as a poor diet high in salt and fat, lack of physical activity, excessive alcohol consumption, and smoking can all contribute to high blood pressure.\n\n4. Obesity: Being overweight or obese puts extra strain on the heart and blood vessels, leading to an increased risk of hypertension.\n\n5. Chronic conditions: Certain medical conditions such as diabetes, kidney disease, and sleep apnea can contribute to high blood pressure.\n\n6. Stress: Chronic stress can cause the body to release hormones that can raise blood pressure.\n\n7. Medications: Certain medications, such as decongestants, oral contraceptives, and nonsteroidal anti-inflammatory drugs (NSAIDs), can elevate blood pressure.\n\nIt is important to note that in some cases, the cause of high blood pressure may not be easily identifiable. It is essential to monitor and manage blood pressure levels through lifestyle changes, medications, and regular check-ups with a healthcare provider."", 'isBot': True}]]",2024-03-21 09:48:21.893,2024-03-21 09:48:21.893,0
65fc030e0b43e64c1851bddf,676b7e60-a7f2-4936-ba25-7d95776eb24d,525d6692-2c89-4871-b945-28f5d35a789b,0321bb40-7826-4ae6-9a0b-0aabc1ddd73a,openai,"[[{'text': 'which food additives pose a risk to your physical health, and are likely to be listed on grocery store labels.\n', 'isBot': False}, {'text': 'Some food additives that pose a risk to physical health and are commonly listed on grocery store labels include:\n\n1. Artificial sweeteners (such as aspartame, saccharin, and sucralose) - these have been linked to various health issues including headaches, digestive problems, and potential risks of cancer.\n\n2. MSG (monosodium glutamate) - known to cause reactions such as headaches, flushing, sweating, and chest pain in some individuals.\n\n3. Artificial colors (such as Red 40, Yellow 5, and Blue 1) - these have been linked to behavioral issues in children, allergies, and potentially carcinogenic effects.\n\n4. Sodium nitrate/nitrite - commonly found in processed meats and has been linked to an increased risk of cancer and heart disease.\n\n5. Trans fats - often found in partially hydrogenated oils and have been linked to an increased risk of heart disease, stroke, and diabetes.\n\nIt is important to carefully read food labels and avoid products that contain these harmful additives in order to protect your physical health.', 'isBot': True}]]",2024-03-21 09:51:10.450,2024-03-21 09:51:10.450,0
65fc03a80b43e64c1851bde7,03053663-2295-49ab-acd9-26d6af3c5295,525d6692-2c89-4871-b945-28f5d35a789b,1185862b-0795-42df-b50f-72bcd9a30f14,openai,"[[{'text': 'A friend has just sent an email from an Internet café in the southern USA where she is on a hiking trip. She tells you that she has just stepped into an anthill of small red ants and has a large number of painful bites on her leg. She wants to know what species of ants they are likely to be. Name one specie of ant.', 'isBot': False}, {'text': 'One species of ant commonly found in the southern USA is the red imported fire ant (Solenopsis invicta). These ants are known for their painful stings and aggressive behavior when disturbed.', 'isBot': True}]]",2024-03-21 09:53:44.343,2024-03-21 09:53:44.343,0
65fc0e2ea7cb0f6660550c44,4231002e-2c20-43e4-8f83-e9669ff83b1a,d235cab9-2a67-4667-8857-a51566cffaf7,325ed10f-5e6d-4da8-adea-3bdfd78db34b,openai,"[[{'text': 'what causes high blood pressure?', 'isBot': False}, {'text': 'There are several factors that can contribute to high blood pressure, including:\n\n1. Genetics: Family history of high blood pressure can increase the risk of developing the condition.\n\n2. Lifestyle habits: Unhealthy habits such as a diet high in sodium, lack of physical activity, smoking, and excessive alcohol consumption can raise blood pressure.\n\n3. Obesity: Being overweight or obese can put added strain on the heart and blood vessels, leading to high blood pressure.\n\n4. Stress: Chronic stress can cause the body to release hormones that constrict blood vessels and increase blood pressure.\n\n5. Age: Blood pressure typically increases with age as blood vessels become less flexible.\n\n6. Chronic conditions: Health conditions such as kidney disease, diabetes, and sleep apnea can contribute to high blood pressure.\n\n7. Medications: Certain medications, such as decongestants, steroids, and birth control pills, can raise blood pressure.\n\nIt is important to consult with a healthcare provider to determine the underlying cause of high blood pressure and develop an appropriate treatment plan.', 'isBot': True}]]",2024-03-21 10:38:38.382,2024-03-21 10:38:38.382,0
65fc0e4ca7cb0f6660550c4c,4cbd77b1-c7fe-435e-ac53-709fada15405,d235cab9-2a67-4667-8857-a51566cffaf7,325ed10f-5e6d-4da8-adea-3bdfd78db34b,openai,,2024-03-21 10:39:08.445,2024-03-21 10:39:08.445,0
65fc0f15a7cb0f6660550c5a,c7f6cc92-1f21-4bf1-b093-9bdbc426f429,d235cab9-2a67-4667-8857-a51566cffaf7,3b814de0-f166-400d-a7d5-3e783f577ef1,openai,"[[{'text': 'Name one specie of ant', 'isBot': False}, {'text': 'Fire ant', 'isBot': True}]]",2024-03-21 10:42:29.858,2024-03-21 10:42:29.858,0
65fc0fa3a7cb0f6660550c68,3946a0c7-665c-4cb8-9260-65c6673a007b,d235cab9-2a67-4667-8857-a51566cffaf7,00ca6fa9-091d-4d30-845f-53c8fb9897df,openai,"[[{'text': 'some issues that need to be considered in deciding between more conventional methods of home heating (fossil energy sources) and solar panels', 'isBot': False}, {'text': ""Cost: One of the main factors to consider when deciding between conventional heating methods and solar panels is the cost. While initially, the installation of solar panels may be more expensive, in the long run, they can save money on energy bills.\n\nAvailability of sunlight: The amount of sunlight available in your area is crucial in determining the effectiveness of solar panels. If you live in a region with limited sunlight, solar panels may not be as efficient as other heating methods.\n\nEnvironmental impact: Conventional heating methods, such as fossil fuels, release greenhouse gases into the atmosphere and contribute to climate change. Solar panels, on the other hand, are a renewable energy source that produces zero emissions.\n\nReliability: Conventional heating methods, such as gas or electric systems, may be more reliable and consistent compared to solar panels, which rely on sunlight. In areas with frequent cloud cover or limited sunlight, solar panels may not be as reliable as other heating methods.\n\nLifespan and maintenance: Solar panels require regular maintenance and may have a shorter lifespan compared to conventional heating systems. It's essential to consider the maintenance and durability of each option when making a decision.\n\nGovernment incentives: Many governments offer incentives and rebates for installing solar panels, making them a more affordable option. It's essential to research any available incentives in your area before deciding on a heating method.\n\nOverall, when deciding between conventional heating methods and solar panels, it's crucial to consider the cost, availability of sunlight, environmental impact, reliability, maintenance, and government incentives. Each option has its advantages and disadvantages, so it's essential to weigh these factors carefully before making a decision."", 'isBot': True}]]",2024-03-21 10:44:51.249,2024-03-21 10:44:51.249,0
